{
  "schemaVersion": 1,
  "questionId": "attention-shapes-01",
  "questionVersion": 2,
  "calibrationStatus": "uncalibrated",
  "evidenceReview": {
    "reviewerRole": "evidence",
    "verdict": "uncalibrated",
    "findings": [
      {
        "code": "verified-score-shape",
        "reason": "The selected matrix shape follows ordinary contraction.",
        "evidence": "[Lq,Dh] @ [Dh,Lk] produces [Lq,Lk].",
        "sourceUrl": "https://docs.pytorch.org/docs/stable/generated/torch.nn.functional.scaled_dot_product_attention",
        "sourceLocator": "Query/key shapes and reference query @ key.transpose(-2,-1)"
      }
    ]
  },
  "itemQualityReview": {
    "reviewerRole": "item-quality",
    "verdict": "uncalibrated",
    "findings": []
  },
  "hardGates": {
    "factuallyCorrect": true,
    "conditionsComplete": true,
    "sourcesVerifiable": true,
    "uniqueAnswer": true,
    "noAnswerLeakage": true,
    "explanationAligned": true
  },
  "anchoredScores": {
    "reasoningDepth": {
      "score": 2,
      "reason": "主要测基础概念或标准流程，深度与 foundation 定位一致。"
    },
    "distractorQuality": {
      "score": 3,
      "reason": "运行时选项同质且对应可辨认的真实误区；多选正确项数量与组合均无固定捷径。"
    },
    "explanationAlignment": {
      "score": 4,
      "reason": "解析与当前运行时选项一致，说明正确机制并处理关键误区或边界。"
    },
    "clarity": {
      "score": 4,
      "reason": "条件、符号和所问对象完整；运行时顺序不存在答案预排序、长度或格式泄题。"
    }
  },
  "verdict": "uncalibrated"
}
