{
  "schemaVersion": 1,
  "questionId": "qkv-roles-10",
  "questionVersion": 2,
  "calibrationStatus": "uncalibrated",
  "evidenceReview": {
    "reviewerRole": "evidence",
    "verdict": "uncalibrated",
    "findings": [
      {
        "code": "verified-joint-permutation-boundary",
        "reason": "The revised prompt scopes scores to QK^T and explicitly excludes masks, score biases, and other position-varying operations, so the invariance claim is complete and unique.",
        "evidence": "For a permutation matrix P, softmax(Q(PK)^T)=softmax(QK^T P^T)=softmax(QK^T)P^T; multiplying by PV cancels the permutation and preserves the output. The stated exclusions remove fixed position terms that would prevent this cancellation.",
        "sourceUrl": "https://arxiv.org/abs/1706.03762",
        "sourceLocator": "Section 3.2.1, equation (1), direct permutation consequence"
      }
    ]
  },
  "itemQualityReview": {
    "reviewerRole": "item-quality",
    "verdict": "uncalibrated",
    "findings": []
  },
  "hardGates": {
    "factuallyCorrect": true,
    "conditionsComplete": true,
    "sourcesVerifiable": true,
    "uniqueAnswer": true,
    "noAnswerLeakage": true,
    "explanationAligned": true
  },
  "anchoredScores": {
    "reasoningDepth": {
      "score": 4,
      "reason": "需要机制推理或边界判断，符合深层认知目标。"
    },
    "distractorQuality": {
      "score": 3,
      "reason": "运行时选项同质且对应可辨认的真实误区；多选正确项数量与组合均无固定捷径。"
    },
    "explanationAlignment": {
      "score": 4,
      "reason": "解析与当前运行时选项一致，说明正确机制并处理关键误区或边界。"
    },
    "clarity": {
      "score": 4,
      "reason": "条件、符号和所问对象完整；运行时顺序不存在答案预排序、长度或格式泄题。"
    }
  },
  "verdict": "uncalibrated"
}
