{
  "schemaVersion": 1,
  "questionId": "attention-masks-10",
  "questionVersion": 2,
  "calibrationStatus": "uncalibrated",
  "evidenceReview": {
    "reviewerRole": "evidence",
    "verdict": "uncalibrated",
    "findings": [
      {
        "code": "verified-fully-masked-row-boundary",
        "reason": "The revised two-answer set is complete: NaN risk and an explicit row policy are valid, while finite-minimum and float32-only guarantees are false.",
        "evidence": "For an all--infinity row, naive max subtraction computes -infinity - -infinity. A finite equal sentinel can normalize to a semantically invalid nonzero distribution, and float32 testing does not establish behavior for half/bfloat16 or fused kernels.",
        "sourceUrl": "https://docs.pytorch.org/docs/stable/generated/torch.nn.functional.scaled_dot_product_attention",
        "sourceLocator": "Reference implementation uses -infinity mask bias followed by softmax; notes on backend and precision differences"
      }
    ]
  },
  "itemQualityReview": {
    "reviewerRole": "item-quality",
    "verdict": "uncalibrated",
    "findings": []
  },
  "hardGates": {
    "factuallyCorrect": true,
    "conditionsComplete": true,
    "sourcesVerifiable": true,
    "uniqueAnswer": true,
    "noAnswerLeakage": true,
    "explanationAligned": true
  },
  "anchoredScores": {
    "reasoningDepth": {
      "score": 4,
      "reason": "需要机制推理或边界判断，符合深层认知目标。"
    },
    "distractorQuality": {
      "score": 3,
      "reason": "运行时选项同质且对应可辨认的真实误区；多选正确项数量与组合均无固定捷径。"
    },
    "explanationAlignment": {
      "score": 4,
      "reason": "解析与当前运行时选项一致，说明正确机制并处理关键误区或边界。"
    },
    "clarity": {
      "score": 4,
      "reason": "条件、符号和所问对象完整；运行时顺序不存在答案预排序、长度或格式泄题。"
    }
  },
  "verdict": "uncalibrated"
}
