{
  "schemaVersion": 1,
  "questionId": "attention-masks-08",
  "questionVersion": 2,
  "calibrationStatus": "uncalibrated",
  "evidenceReview": {
    "reviewerRole": "evidence",
    "verdict": "uncalibrated",
    "findings": [
      {
        "code": "verified-api-mask-portability",
        "reason": "The selected checks directly cover two documented cross-API incompatibilities.",
        "evidence": "PyTorch SDPA boolean True means participate, while MultiheadAttention boolean True means forbidden; both APIs also document distinct accepted mask shapes.",
        "sourceUrl": "https://docs.pytorch.org/docs/stable/generated/torch.nn.functional.scaled_dot_product_attention",
        "sourceLocator": "attn_mask parameter; compare torch.nn.MultiheadAttention attn_mask/key_padding_mask parameters"
      }
    ]
  },
  "itemQualityReview": {
    "reviewerRole": "item-quality",
    "verdict": "uncalibrated",
    "findings": []
  },
  "hardGates": {
    "factuallyCorrect": true,
    "conditionsComplete": true,
    "sourcesVerifiable": true,
    "uniqueAnswer": true,
    "noAnswerLeakage": true,
    "explanationAligned": true
  },
  "anchoredScores": {
    "reasoningDepth": {
      "score": 3,
      "reason": "需要把定义用于形状、数值或排障场景，符合应用层级。"
    },
    "distractorQuality": {
      "score": 3,
      "reason": "运行时选项同质且对应可辨认的真实误区；多选正确项数量与组合均无固定捷径。"
    },
    "explanationAlignment": {
      "score": 4,
      "reason": "解析与当前运行时选项一致，说明正确机制并处理关键误区或边界。"
    },
    "clarity": {
      "score": 4,
      "reason": "条件、符号和所问对象完整；运行时顺序不存在答案预排序、长度或格式泄题。"
    }
  },
  "verdict": "uncalibrated"
}
