{
  "schemaVersion": 1,
  "questionId": "scaled-dot-product-12",
  "questionVersion": 2,
  "calibrationStatus": "uncalibrated",
  "evidenceReview": {
    "reviewerRole": "evidence",
    "verdict": "uncalibrated",
    "findings": [
      {
        "code": "verified-scaling-recall-rubric",
        "reason": "The rubric accurately separates variance, standard deviation, softmax behavior and approximation boundaries.",
        "evidence": "The original argument gives variance d_k, standard deviation sqrt(d_k), and warns that large dot products push softmax into regions with very small gradients.",
        "sourceUrl": "https://arxiv.org/abs/1706.03762",
        "sourceLocator": "Section 3.2.1 and footnote 4"
      }
    ]
  },
  "itemQualityReview": {
    "reviewerRole": "item-quality",
    "verdict": "uncalibrated",
    "findings": []
  },
  "hardGates": {
    "factuallyCorrect": true,
    "conditionsComplete": true,
    "sourcesVerifiable": true,
    "uniqueAnswer": true,
    "noAnswerLeakage": true,
    "explanationAligned": true
  },
  "anchoredScores": {
    "reasoningDepth": {
      "score": 4,
      "reason": "要求组织多步机制并处理边界，最低充分答案与部分掌握已分层。"
    },
    "distractorQuality": {
      "score": 4,
      "reason": "口述题以明确的关键误区、最低充分答案和部分得分锚点支持稳定判分。"
    },
    "explanationAlignment": {
      "score": 4,
      "reason": "解析与当前运行时选项一致，说明正确机制并处理关键误区或边界。"
    },
    "clarity": {
      "score": 4,
      "reason": "条件、符号和所问对象完整；运行时顺序不存在答案预排序、长度或格式泄题。"
    }
  },
  "verdict": "uncalibrated"
}
